{
	"title": {
		"default": "Universität Bern: Wahlen des SUB-StudentInnenrates",
		"french": "Université de Berne: Élection du conseil des étudiant-e-s SUB",
		"english": "University of Bern: SUB Elections"
	},
	"administration": {
		"default": "StudentInnenschaft der Universität Bern (SUB)",
		"french": "Ensemble des étudiants de l'Université de Berne (SUB)",
		"english": "Student Body of the University of Bern (SUB)"
	},
	"votingPeriodBegin": "2015-03-08T23:00:00Z",
	"votingPeriodEnd": "2015-03-26T11:00:00Z"
}
